{
  "schema_version": "rfc006/v1/packet-core-experimental",
  "evidence_id": "epdg-ikev2-auth-request-001",
  "protocol": "IKEv2",
  "scenario": "IKE_AUTH exchange with EAP-AKA",
  "message_direction": "uplink",
  "payload_summary": "IKE_AUTH request carrying IDi and CP payload; no raw identifiers present",
  "payload_digest": "sha256:0123456789abcdef0123456789abcdef0123456789abcdef0123456789abcdef",
  "conformance_tags": ["@spec RFC 7296 §1.2", "@req REQ-IETF-RFC7296-R1-1.2-001"],
  "requirements": ["REQ-IETF-RFC7296-R1-1.2-001"],
  "fixture_source": "spec-authored from RFC 7296 §1.2",
  "fixture_provenance": "hand-authored from independent spec reading; not derived from SDK encoder output",
  "captured_at": "2026-06-28T00:00:00Z",
  "notes": "Experimental protocol evidence shape for ePDG smoke artifact comparability."
}
